{
  "created_at": "2026-08-10T12:00:00Z",
  "current_state": "initialized",
  "editable_surfaces": ["researcher/runs/example/proposals/"],
  "locked_surfaces": ["governance/constitution.yaml"],
  "run_id": "20260810-120000-schema-contract",
  "source_url": "https://example.com/schema-contract",
  "state_history": [
    {
      "evidence": "researcher/runs/example",
      "reason": "fixture initialized",
      "state": "initialized",
      "timestamp": "2026-08-10T12:00:00Z"
    }
  ],
  "title": "Schema contract fixture",
  "updated_at": "2026-08-10T12:00:00Z"
}
