{
  "run_id": "20260515-035228-executable-autonomous-research-frameworks",
  "title": "Executable autonomous research frameworks",
  "source_url": "https://platform.parallel.ai/play/deep-research/trun_64f5be03055a4b52adf17481e4b865bc",
  "current_state": "closed",
  "close_status": "reference-only",
  "close_reason": "Seed run captured the deep-research evidence that bootstrapped the harness-engineering skill, the mechanism registry, and the researcher OS. Closed as reference-only: its raw evidence and THREAD.md remain as a worked example of the autonomous-loop lifecycle. The skill change itself was already published; no further PR derives from this run.",
  "locked_surfaces": [
    "researcher/rubrics/content-curation.md",
    "researcher/rubrics/skill-change.md",
    "researcher/rubrics/harness-change.md",
    "researcher/mechanisms/registry.jsonl",
    ".claude-plugin/marketplace.json",
    ".plugin/plugin.json",
    "researcher/scripts/validate_repo.py"
  ],
  "editable_surfaces": [
    "researcher/runs/20260515-035228-executable-autonomous-research-frameworks/sources/",
    "researcher/runs/20260515-035228-executable-autonomous-research-frameworks/proposals/",
    "researcher/runs/20260515-035228-executable-autonomous-research-frameworks/reports/",
    "researcher/runs/20260515-035228-executable-autonomous-research-frameworks/logs/"
  ],
  "state_history": [
    {
      "state": "initialized",
      "timestamp": "2026-05-15T03:52:28+00:00",
      "reason": "run initialized",
      "evidence": "researcher/runs/20260515-035228-executable-autonomous-research-frameworks"
    },
    {
      "state": "retrieved",
      "timestamp": "2026-05-15T04:12:00+00:00",
      "reason": "raw deep research evidence captured under run evidence",
      "evidence": "researcher/runs/20260515-035228-executable-autonomous-research-frameworks/sources/evidence/raw"
    },
    {
      "state": "closed",
      "timestamp": "2026-05-15T05:19:20+00:00",
      "reason": "Seed run captured the deep-research evidence that bootstrapped the harness-engineering skill, the mechanism registry, and the researcher OS. Closed as reference-only: its raw evidence and THREAD.md remain as a worked example of the autonomous-loop lifecycle. The skill change itself was already published; no further PR derives from this run.",
      "evidence": "researcher/runs/20260515-035228-executable-autonomous-research-frameworks/reports/closure.json"
    }
  ],
  "created_at": "2026-05-15T03:52:28+00:00",
  "updated_at": "2026-05-15T05:19:20+00:00"
}
